Title,File Name,URL
PREDICTION OF GLIOMA USING GENETIC OPTIMIZED NEURAL NETWORK,2013_9_11_jcssp.2013.1543.1555.pdf,https://thescipub.com/pdf/jcssp.2013.1543.1555.pdf
A NOVEL APPROACH FOR INFORMATION SECURITY IN AD HOC NETWORKS THROUGH SECURE KEY MANAGEMENT,2013_9_11_jcssp.2013.1556.1565.pdf,https://thescipub.com/pdf/jcssp.2013.1556.1565.pdf
DESIGN OF A DUAL KEYBOARD,2013_9_11_jcssp.2013.1566.1574.pdf,https://thescipub.com/pdf/jcssp.2013.1566.1574.pdf
SHADOW DETECTION USING COLOR AND EDGE INFORMATION,2013_9_11_jcssp.2013.1575.1588.pdf,https://thescipub.com/pdf/jcssp.2013.1575.1588.pdf
CONSTRAINT INFORMATIVE RULES FOR GENETIC ALGORITHM-BASED WEB PAGE RECOMMENDATION SYSTEM,2013_9_11_jcssp.2013.1589.1601.pdf,https://thescipub.com/pdf/jcssp.2013.1589.1601.pdf
A CONTEXT-BASED TECHNIQUE USING TAG-TREE FOR AN EFFECTIVE RETRIEVAL FROM A DIGITAL LITERATURE COLLECTION,2013_9_11_jcssp.2013.1602.1617.pdf,https://thescipub.com/pdf/jcssp.2013.1602.1617.pdf
DETERIORATING DISTRIBUTED DENIAL OF SERVICE ATTACK BY RECOVERING ZOMBIES USING PENALTY SCHEME,2013_9_11_jcssp.2013.1618.1625.pdf,https://thescipub.com/pdf/jcssp.2013.1618.1625.pdf
PERFORMANCE EVALUATION OF WORMHOLE SECURITY APPROACHES FOR AD-HOC NETWORKS,2013_9_12_jcssp.2013.1626.1637.pdf,https://thescipub.com/pdf/jcssp.2013.1626.1637.pdf
SERVICE ORIENTED ARCHITECTURE GOVERNANCE IMPLEMENTATION IN A SOFTWARE DEVELOPMENT PROJECT AS AN ENTERPRISE SOLUTIONS,2013_9_12_jcssp.2013.1638.1647.pdf,https://thescipub.com/pdf/jcssp.2013.1638.1647.pdf
THE ERROR REGISTRATION TECHNIQUE FOR MANEUVERING RADAR NETWORK,2013_9_12_jcssp.2013.1648.1660.pdf,https://thescipub.com/pdf/jcssp.2013.1648.1660.pdf
ADAPTIVE RESOURCE CONTROL MECHANISM THROUGH REPUTATION-BASED SCHEDULING IN HETEROGENEOUS DISTRIBUTED SYSTEMS,2013_9_12_jcssp.2013.1661.1668.pdf,https://thescipub.com/pdf/jcssp.2013.1661.1668.pdf
A SURVEY: PARTICLE SWARM OPTIMIZATION-BASED ALGORITHMS FOR GRID COMPUTING SCHEDULING SYSTEMS,2013_9_12_jcssp.2013.1669.1679.pdf,https://thescipub.com/pdf/jcssp.2013.1669.1679.pdf
THE RATIONAL BEHIND THE SERVAL NETWORK LAYER FOR RESILIENT COMMUNICATIONS,2013_9_12_jcssp.2013.1680.1685.pdf,https://thescipub.com/pdf/jcssp.2013.1680.1685.pdf
IMPACT OF SOCIAL INFLUENCE ON INDIVIDUALS’ ADOPTION OF SOCIAL NETWORKS IN SMES,2013_9_12_jcssp.2013.1686.1694.pdf,https://thescipub.com/pdf/jcssp.2013.1686.1694.pdf
NEW TRACK-TO-TRACK CORRELATION ALGORITHMS BASED ON BITHRESHOLD IN A DISTRIBUTED MULTISENSOR INFORMATION FUSION SYSTEM,2013_9_12_jcssp.2013.1695.1709.pdf,https://thescipub.com/pdf/jcssp.2013.1695.1709.pdf
AN IN-DEPTH ANALYSIS ON INTEGRATING CAMPUS RADIO FREQUENCY IDENTIFICATION SYSTEM ON CLOUDS FOR ENHANCING SECURITY,2013_9_12_jcssp.2013.1710.1714.pdf,https://thescipub.com/pdf/jcssp.2013.1710.1714.pdf
OBJECTIONABLE IMAGE DETECTION IN CLOUD COMPUTING PARADIGM-A REVIEW,2013_9_12_jcssp.2013.1715.1721.pdf,https://thescipub.com/pdf/jcssp.2013.1715.1721.pdf
EFFECTIVE BLACK HOLE ATTACKS IN MANETS,2013_9_12_jcssp.2013.1722.1733.pdf,https://thescipub.com/pdf/jcssp.2013.1722.1733.pdf
SMART TRAVELLING WITH RADIO FREQUENCY IDENTIFICATION,2013_9_12_jcssp.2013.1734.1737.pdf,https://thescipub.com/pdf/jcssp.2013.1734.1737.pdf
M-ARRAY QUADRATURE AMPLITUDE MODULATION WIRELESS SENSOR NETWORK MODULATOR RELIABILITY AND ACCURACY ANALYZE IN CIVIL SHM,2013_9_12_jcssp.2013.1738.1746.pdf,https://thescipub.com/pdf/jcssp.2013.1738.1746.pdf
A NOVEL HYBRID NODE LOCALIZATION ALGORITHM FOR WIRELESS SENSOR NETWORKS,2013_9_12_jcssp.2013.1747.1760.pdf,https://thescipub.com/pdf/jcssp.2013.1747.1760.pdf
DEVELOPMENT OF A FUZZY-SIMULATION MODEL OF SCHEDULING ROBOTIC FLEXIBLE ASSEMBLY CELLS,2013_9_12_jcssp.2013.1761.1768.pdf,https://thescipub.com/pdf/jcssp.2013.1761.1768.pdf
APPLICATION OF A FUZZY-SIMULATION MODEL OF SCHEDULING ROBOTIC FLEXIBLE ASSEMBLY CELLS,2013_9_12_jcssp.2013.1769.1777.pdf,https://thescipub.com/pdf/jcssp.2013.1769.1777.pdf
A NOVEL OPTIMIZATION MODEL FOR SIMULTANEOUS COST-RISK REDUCTION IN MULTI-SUPPLIERS JUST-IN-TIME SYSTEMS,2013_9_12_jcssp.2013.1778.1792.pdf,https://thescipub.com/pdf/jcssp.2013.1778.1792.pdf
TEXT SIGNAGE RECOGNITION IN ANDROID MOBILE DEVICES,2013_9_12_jcssp.2013.1793.1802.pdf,https://thescipub.com/pdf/jcssp.2013.1793.1802.pdf
DEVELOPMENT OF A PROXIMAL MACHINE VISION SYSTEM FOR OFF-SEASON WEED MAPPING IN BROADACRE NO-TILLAGE FALLOWS,2013_9_12_jcssp.2013.1803.1821.pdf,https://thescipub.com/pdf/jcssp.2013.1803.1821.pdf
STRUCTURAL AND OPERATIONAL COMPLEXITY OF MANUAL ASSEMBLY SYSTEMS,2013_9_12_jcssp.2013.1822.1829.pdf,https://thescipub.com/pdf/jcssp.2013.1822.1829.pdf
“OPTIMIZATION OF MULTI-COMMODITIES CONSUMER SUPPLY CHAINS FOR-PART I-MODELING”,2013_9_12_jcssp.2013.1830.1846.pdf,https://thescipub.com/pdf/jcssp.2013.1830.1846.pdf
INFORMATION TECHNOLOGY STRATEGIC PLANNING AT PT. VENTURIUM SYSTEM,2013_9_12_jcssp.2013.1847.1855.pdf,https://thescipub.com/pdf/jcssp.2013.1847.1855.pdf
Distribution Key in Eight Bit's Color Image Algorithm,2012_8_1_jcssp.2012.1.5.pdf,https://thescipub.com/pdf/jcssp.2012.1.5.pdf
An Efficient Implementation of Weighted Fuzzy Fisherface Algorithm for Face Recognition Using Wavelet Transform,2012_8_1_jcssp.2012.6.12.pdf,https://thescipub.com/pdf/jcssp.2012.6.12.pdf
Mobility and Density Aware AODV Protocol Extension for Mobile Adhoc Networks-MADA-AODV,2012_8_1_jcssp.2012.13.17.pdf,https://thescipub.com/pdf/jcssp.2012.13.17.pdf
Cerebrovascular Accident Attack Classification Using Multilayer Feed Forward Artificial Neural Network with Back Propagation Error,2012_8_1_jcssp.2012.18.25.pdf,https://thescipub.com/pdf/jcssp.2012.18.25.pdf
Efficient Face Recognition in Video by Bit Planes Slicing,2012_8_1_jcssp.2012.26.30.pdf,https://thescipub.com/pdf/jcssp.2012.26.30.pdf
"Information Systems Development Knowledge  Sharing-Organizational Justice, Physical Distance and Social Interdependence",2012_8_1_jcssp.2012.31.40.pdf,https://thescipub.com/pdf/jcssp.2012.31.40.pdf
Linear Protection Schemes Analysis in Scattered Placement Fiber-To-The Home-Passive Optical Network Using Customer Access Protection Unit Solution,2012_8_1_jcssp.2012.41.47.pdf,https://thescipub.com/pdf/jcssp.2012.41.47.pdf
A Genetic Based Neuro Fuzzy Technique for Process Grain Sized Scheduling of Parallel Jobs,2012_8_1_jcssp.2012.48.54.pdf,https://thescipub.com/pdf/jcssp.2012.48.54.pdf
Energy Efficient Aggregation for Continuous Monitoring Applications of Wireless Sensor Network,2012_8_1_jcssp.2012.55.60.pdf,https://thescipub.com/pdf/jcssp.2012.55.60.pdf
First Token Algorithm for Searching Compound Terms Using Thesaurus Database,2012_8_1_jcssp.2012.61.67.pdf,https://thescipub.com/pdf/jcssp.2012.61.67.pdf
Effective Utilization of Multicore Processor for Unified Threat Management Functions,2012_8_1_jcssp.2012.68.75.pdf,https://thescipub.com/pdf/jcssp.2012.68.75.pdf
A Comparison between Electrical and Optical Chromatic Dispersion Compensation in Wavelength Divison Multiplexing Network Regarding to Electrical Pulse Shapes,2012_8_1_jcssp.2012.76.83.pdf,https://thescipub.com/pdf/jcssp.2012.76.83.pdf
The Effect of Temperature on the Performance of Uncooled Semiconductor Laser Diode in Optical Network,2012_8_1_jcssp.2012.84.88.pdf,https://thescipub.com/pdf/jcssp.2012.84.88.pdf
A Data Mining Technique to Find Optimal Customers for Beneficial Customer Relationship Management,2012_8_1_jcssp.2012.89.98.pdf,https://thescipub.com/pdf/jcssp.2012.89.98.pdf
Common Modeling Language for Model Checkers,2012_8_1_jcssp.2012.99.106.pdf,https://thescipub.com/pdf/jcssp.2012.99.106.pdf
Engineering Privacy Revisited,2012_8_1_jcssp.2012.107.120.pdf,https://thescipub.com/pdf/jcssp.2012.107.120.pdf
"Wireless Body Area Sensor Networks Signal Processing and Communication Framework:  Survey on Sensing, Communication Technologies, Delivery and Feedback",2012_8_1_jcssp.2012.121.132.pdf,https://thescipub.com/pdf/jcssp.2012.121.132.pdf
Automatic Multi Document Summarization Approaches,2012_8_1_jcssp.2012.133.140.pdf,https://thescipub.com/pdf/jcssp.2012.133.140.pdf
Analytical Study of Signal-to-Noise Ratio for Visible Light Communication by Using Single Source,2012_8_1_jcssp.2012.141.144.pdf,https://thescipub.com/pdf/jcssp.2012.141.144.pdf
Performance Analysis on 16-Channels Wavelength Division Multiplexing in Free Space Optical Transmission under Tropical Regions Environment,2012_8_1_jcssp.2012.145.148.pdf,https://thescipub.com/pdf/jcssp.2012.145.148.pdf
Optimal Network Design for Efficient Energy Utilization in Wireless Sensor Networks,2012_8_1_jcssp.2012.149.158.pdf,https://thescipub.com/pdf/jcssp.2012.149.158.pdf
The Effect of the Bone-Plate Whole Spacing on the Interfragmentary Strain,2012_8_1_jcssp.2012.159.162.pdf,https://thescipub.com/pdf/jcssp.2012.159.162.pdf
An Efficient Hand-off Mechanism for Vehicular Networks,2012_8_1_jcssp.2012.163.169.pdf,https://thescipub.com/pdf/jcssp.2012.163.169.pdf
A Review on Recent Research and Implementation Methodologies on Medical Image Segmentation,2012_8_1_jcssp.2012.170.174.pdf,https://thescipub.com/pdf/jcssp.2012.170.174.pdf
Hybrid Algorithm for Optimal Load Sharing in Grid Computing,2012_8_1_jcssp.2012.175.180.pdf,https://thescipub.com/pdf/jcssp.2012.175.180.pdf
Adhoc on Demand Multipath Reliable and Energy Aware Quality of Service Routing for Mobile Adhoc Networks,2012_8_2_jcssp.2012.181.187.pdf,https://thescipub.com/pdf/jcssp.2012.181.187.pdf
A New Cooperative Algorithm Based on PSO and K-Means for Data Clustering,2012_8_2_jcssp.2012.188.194.pdf,https://thescipub.com/pdf/jcssp.2012.188.194.pdf
Detection of Aberrant Data Points for an effective Effort Estimation using an Enhanced Algorithm with Adaptive Features,2012_8_2_jcssp.2012.195.199.pdf,https://thescipub.com/pdf/jcssp.2012.195.199.pdf
Fuzzy Velocity Biased-Ad Hoc on Demand Distance Vector to Improve Throughput in Dynamic Mobile Network,2012_8_2_jcssp.2012.200.204.pdf,https://thescipub.com/pdf/jcssp.2012.200.204.pdf
Ontological Approach for Effective Generation of  Concept Based User Profiles to Personalize Search Results,2012_8_2_jcssp.2012.205.215.pdf,https://thescipub.com/pdf/jcssp.2012.205.215.pdf
Geographical Division Traceback for Distributed Denial of Service,2012_8_2_jcssp.2012.216.221.pdf,https://thescipub.com/pdf/jcssp.2012.216.221.pdf
Web-Facilitated Learning for Bioethics Principles on Human Dignity and Human Rights,2012_8_2_jcssp.2012.222.226.pdf,https://thescipub.com/pdf/jcssp.2012.222.226.pdf
Artificial Bee Colony based Energy Aware and Energy Efficient Routing Protocol,2012_8_2_jcssp.2012.227.231.pdf,https://thescipub.com/pdf/jcssp.2012.227.231.pdf
Secure Authentication Technique for Data Aggregation in Wireless Sensor Networks,2012_8_2_jcssp.2012.232.238.pdf,https://thescipub.com/pdf/jcssp.2012.232.238.pdf
Performance Analysis of Rejection Ratio in Cost Optimized Virtual Private Networks Provisioning Algorithm (COVPA) Using Waxman and Barabasi Model in Cyber Space,2012_8_2_jcssp.2012.239.242.pdf,https://thescipub.com/pdf/jcssp.2012.239.242.pdf
Retrieval Optimization Technique for Tuple Timestamp Historical Relation Temporal Data Model,2012_8_2_jcssp.2012.243.250.pdf,https://thescipub.com/pdf/jcssp.2012.243.250.pdf
An Improved Approach for Topic Ontology Based Categorization of Blogs Using Support Vector Machine,2012_8_2_jcssp.2012.251.258.pdf,https://thescipub.com/pdf/jcssp.2012.251.258.pdf
A New Ventricular Late Potential Classification System Using Ant Colony Optimization,2012_8_2_jcssp.2012.259.264.pdf,https://thescipub.com/pdf/jcssp.2012.259.264.pdf
Solving Two Deadlock Cycles through Neighbor Replication on Grid Deadlock Detection Model,2012_8_2_jcssp.2012.265.271.pdf,https://thescipub.com/pdf/jcssp.2012.265.271.pdf
Supporting Best Practices and Standards for Information Technology Infrastructure Library,2012_8_2_jcssp.2012.272.276.pdf,https://thescipub.com/pdf/jcssp.2012.272.276.pdf
Arabic to English Machine Translation of Verb Phrases Using Rule-Based Approach,2012_8_3_jcssp.2012.277.286.pdf,https://thescipub.com/pdf/jcssp.2012.277.286.pdf
A Qualitative Analysis of Independent Component Analysis Based Algorithms for the Removal of Artifacts from Electroencephalography Signals,2012_8_3_jcssp.2012.287.295.pdf,https://thescipub.com/pdf/jcssp.2012.287.295.pdf
A Distributed Coverage and Target Tracking Algorithm for Wireless Sensor Networks,2012_8_3_jcssp.2012.296.304.pdf,https://thescipub.com/pdf/jcssp.2012.296.304.pdf
High Performance Computing on Fast Lock Delay Locked Loop with Low Power State and Simultanoeus Switching Noise Reduction,2012_8_3_jcssp.2012.305.309.pdf,https://thescipub.com/pdf/jcssp.2012.305.309.pdf
A Vehicle License Plate Detection and Recognition System,2012_8_3_jcssp.2012.310.315.pdf,https://thescipub.com/pdf/jcssp.2012.310.315.pdf
Effective Hierarchical Information Management in Mobile Environment,2012_8_3_jcssp.2012.316.322.pdf,https://thescipub.com/pdf/jcssp.2012.316.322.pdf
Role of Information Technology Infrastructure Library in E-Government,2012_8_3_jcssp.2012.323.328.pdf,https://thescipub.com/pdf/jcssp.2012.323.328.pdf
Mammogram Analysis Based on Pixel Intensity Mean Features,2012_8_3_jcssp.2012.329.332.pdf,https://thescipub.com/pdf/jcssp.2012.329.332.pdf
Efficient Sensor Stream Data Processing System to use Cache Technique for Ubiquitous Sensor Network Application Service,2012_8_3_jcssp.2012.333.336.pdf,https://thescipub.com/pdf/jcssp.2012.333.336.pdf
A Study of the Production Rules for Context Inference of Wetland Water Quality on Ubiquitous Sensor Network Middleware Framework,2012_8_3_jcssp.2012.337.341.pdf,https://thescipub.com/pdf/jcssp.2012.337.341.pdf
Wetland Ontology Modeling to Apply the Context-Aware Technology for Application Service Environment,2012_8_3_jcssp.2012.342.347.pdf,https://thescipub.com/pdf/jcssp.2012.342.347.pdf
Session Initiation Protocol Security: A Brief Review,2012_8_3_jcssp.2012.348.357.pdf,https://thescipub.com/pdf/jcssp.2012.348.357.pdf
Intelligent Model for Traffic Safety Applications,2012_8_3_jcssp.2012.358.365.pdf,https://thescipub.com/pdf/jcssp.2012.358.365.pdf
The Soft Systems Methodology Based Analysis Model in the Development of Selfmanaging Information Systems,2012_8_3_jcssp.2012.366.373.pdf,https://thescipub.com/pdf/jcssp.2012.366.373.pdf
Information Technology Role in Reducing E-Banking Services Risk in Jordanian Banking Sector,2012_8_3_jcssp.2012.374.381.pdf,https://thescipub.com/pdf/jcssp.2012.374.381.pdf
Aspect Oriented Decision Making Model for Byzantine Agreement,2012_8_3_jcssp.2012.382.388.pdf,https://thescipub.com/pdf/jcssp.2012.382.388.pdf
Lessons Learned in Transforming from Traditional to Agile Development,2012_8_3_jcssp.2012.389.392.pdf,https://thescipub.com/pdf/jcssp.2012.389.392.pdf
An Analysis and Overview of Wireless Routing Protocols,2012_8_3_jcssp.2012.393.397.pdf,https://thescipub.com/pdf/jcssp.2012.393.397.pdf
"Risk Reduction in Operations, Maintenance and Application for Customer Access Network",2012_8_3_jcssp.2012.398.409.pdf,https://thescipub.com/pdf/jcssp.2012.398.409.pdf
A Framework for Teaching Programming on the Internet: A Web-Based Simulation Approach,2012_8_3_jcssp.2012.410.419.pdf,https://thescipub.com/pdf/jcssp.2012.410.419.pdf
A Cross Layer Frame Work for Enhanced Quality of Service Provisioning in Worldwide Interoperability for Microwave Access Networks,2012_8_3_jcssp.2012.420.424.pdf,https://thescipub.com/pdf/jcssp.2012.420.424.pdf
Application of Syndication to the Management of Bibliographic Catalogs,2012_8_3_jcssp.2012.425.430.pdf,https://thescipub.com/pdf/jcssp.2012.425.430.pdf
Multimodal Biometrics using Feature Fusion,2012_8_3_jcssp.2012.431.435.pdf,https://thescipub.com/pdf/jcssp.2012.431.435.pdf
Retinal Image Analysis for Abnormality Detection-An Overview,2012_8_3_jcssp.2012.436.442.pdf,https://thescipub.com/pdf/jcssp.2012.436.442.pdf
Smart Wireless System in Fiber to the Home,2012_8_3_jcssp.2012.443.448.pdf,https://thescipub.com/pdf/jcssp.2012.443.448.pdf
Multiple Input Multiple Output System with Space Time Block Coding and Orthogonal Frequency Division Multiplexing,2012_8_4_jcssp.2012.449.453.pdf,https://thescipub.com/pdf/jcssp.2012.449.453.pdf
Multipath Adaptive Packet Dispersion for Voice Applications,2012_8_4_jcssp.2012.454.459.pdf,https://thescipub.com/pdf/jcssp.2012.454.459.pdf
Cross-Layer Design for Reducing the Energy Consumption based on Mobility Parameter in DSR for Mobile Ad-Hoc Network,2012_8_4_jcssp.2012.460.467.pdf,https://thescipub.com/pdf/jcssp.2012.460.467.pdf
An Interaction between Congestion-Control Based Transport Protocols and Manet Routing Protocols,2012_8_4_jcssp.2012.468.473.pdf,https://thescipub.com/pdf/jcssp.2012.468.473.pdf
Flexible Topology Migration in Optical Cross Add and Drop Multiplexer in Metropolitan Ring Network,2012_8_4_jcssp.2012.474.481.pdf,https://thescipub.com/pdf/jcssp.2012.474.481.pdf
Finite Element Analysis of Large Capacity Endplate Steel Connections,2012_8_4_jcssp.2012.482.493.pdf,https://thescipub.com/pdf/jcssp.2012.482.493.pdf
Low-Loss Hand-Made Demultiplexer using Transparent Color Filter in WDM-POF Network for Short-Haul Communication System,2012_8_4_jcssp.2012.494.498.pdf,https://thescipub.com/pdf/jcssp.2012.494.498.pdf
Heart Localization from Magnetic Resonance Images Sequence,2012_8_4_jcssp.2012.499.505.pdf,https://thescipub.com/pdf/jcssp.2012.499.505.pdf
Steel Plates Faults Diagnosis with Data Mining Models,2012_8_4_jcssp.2012.506.514.pdf,https://thescipub.com/pdf/jcssp.2012.506.514.pdf
Adaptive Complementary Metal-Oxide-Semiconductor Device by Externally Controlled Gate Oxide Thickness,2012_8_4_jcssp.2012.515.522.pdf,https://thescipub.com/pdf/jcssp.2012.515.522.pdf
Computation of Private Key Based on Divide-By-Prime for Luc Cryptosystems,2012_8_4_jcssp.2012.523.527.pdf,https://thescipub.com/pdf/jcssp.2012.523.527.pdf
In-Process Vision Inspection Systems for Sorting using Image Processing Techniques,2012_8_4_jcssp.2012.528.532.pdf,https://thescipub.com/pdf/jcssp.2012.528.532.pdf
A Reduction Algorithm for Analysis of Linear Neuron,2012_8_4_jcssp.2012.533.537.pdf,https://thescipub.com/pdf/jcssp.2012.533.537.pdf
Integrated Resource and Cost Management Scheme for Computational Grids,2012_8_4_jcssp.2012.538.544.pdf,https://thescipub.com/pdf/jcssp.2012.538.544.pdf
Similarity Based Clustering with Indexing for Semi-Structured Document,2012_8_4_jcssp.2012.545.550.pdf,https://thescipub.com/pdf/jcssp.2012.545.550.pdf
Temperature Effect on Uncooled Semiconductor Laser Diode to the Network Performance System,2012_8_4_jcssp.2012.551.555.pdf,https://thescipub.com/pdf/jcssp.2012.551.555.pdf
Third Order of Automatic Restoration Scheme Offered in Fiber ToThe Home-Passive Optical Network through Customer Access Protection Unit,2012_8_4_jcssp.2012.556.563.pdf,https://thescipub.com/pdf/jcssp.2012.556.563.pdf
Purpose-based Versus Flow-Based Access Control for Privacy,2012_8_4_jcssp.2012.564.572.pdf,https://thescipub.com/pdf/jcssp.2012.564.572.pdf
An Evolutionary Algorithmic Approach based Optimal Web Service Selection for Composition with Quality of Service,2012_8_4_jcssp.2012.573.578.pdf,https://thescipub.com/pdf/jcssp.2012.573.578.pdf
Range Detection Multicast Routing Protocol for Mobile Ad-Hoc Networks,2012_8_4_jcssp.2012.579.584.pdf,https://thescipub.com/pdf/jcssp.2012.579.584.pdf
Implementation of Line Stability Index for Contingency Analysis and Screening in Power Systems,2012_8_4_jcssp.2012.585.590.pdf,https://thescipub.com/pdf/jcssp.2012.585.590.pdf
Customer-Made 3×3 Polymer Optical Fiber Splitter Based on Green Technology using Fusion Technique,2012_8_4_jcssp.2012.591.598.pdf,https://thescipub.com/pdf/jcssp.2012.591.598.pdf
Mining of Datasets with an Enhanced Apriori Algorithm,2012_8_4_jcssp.2012.599.605.pdf,https://thescipub.com/pdf/jcssp.2012.599.605.pdf
A Real Time Practical Approach for Multi Objective Job Shop Scheduling Using Fuzzy Logic Approach,2012_8_4_jcssp.2012.606.612.pdf,https://thescipub.com/pdf/jcssp.2012.606.612.pdf
Variable Neighborhood Simplex Search Methods for Global Optimization Models,2012_8_4_jcssp.2012.613.620.pdf,https://thescipub.com/pdf/jcssp.2012.613.620.pdf
A New Self-Adaptive Neuro Fuzzy Inference System for the Removal of  Non-Linear Artifacts from the Respiratory Signal,2012_8_5_jcssp.2012.621.631.pdf,https://thescipub.com/pdf/jcssp.2012.621.631.pdf
Dynamic Approach to Defend Against Distributed Denial of Service Attacks Using an Adaptive Spin Lock Rate Control Mechanism,2012_8_5_jcssp.2012.632.636.pdf,https://thescipub.com/pdf/jcssp.2012.632.636.pdf
Enhancing Security in E-Health Communications using Multi-Agent System,2012_8_5_jcssp.2012.637.647.pdf,https://thescipub.com/pdf/jcssp.2012.637.647.pdf
Adaptive Multi-Path Routing for Load Balancing in Mobile Ad Hoc Networks,2012_8_5_jcssp.2012.648.655.pdf,https://thescipub.com/pdf/jcssp.2012.648.655.pdf
A Density Based Dynamic Data Clustering Algorithm based on Incremental Dataset ,2012_8_5_jcssp.2012.656.664.pdf,https://thescipub.com/pdf/jcssp.2012.656.664.pdf
A Forager Bee's Intelligence Inspired Dynamic Queue Scheduling for the Internet Traffic,2012_8_5_jcssp.2012.665.672.pdf,https://thescipub.com/pdf/jcssp.2012.665.672.pdf
A Fault Tolerant Congestion Aware Routing Protocol for Mobile Adhoc Networks,2012_8_5_jcssp.2012.673.680.pdf,https://thescipub.com/pdf/jcssp.2012.673.680.pdf
Integration of Genetic Algorithm with Tabu Search for Job Shop Scheduling with Unordered Subsequence Exchange Crossover,2012_8_5_jcssp.2012.681.693.pdf,https://thescipub.com/pdf/jcssp.2012.681.693.pdf
Performance of Improved Directed Diffusion Protocol for Sensor Networks under Different Mobility Models,2012_8_5_jcssp.2012.694.700.pdf,https://thescipub.com/pdf/jcssp.2012.694.700.pdf
Features Extraction Based on Linear Regression Technique,2012_8_5_jcssp.2012.701.704.pdf,https://thescipub.com/pdf/jcssp.2012.701.704.pdf
Parallel Memetic Algorithm for VLSI Circuit Partitioning Problem using Graphical Processing Units,2012_8_5_jcssp.2012.705.710.pdf,https://thescipub.com/pdf/jcssp.2012.705.710.pdf
The Best Candidates Method for Solving Optimization Problems,2012_8_5_jcssp.2012.711.715.pdf,https://thescipub.com/pdf/jcssp.2012.711.715.pdf
Segmentation of Ureteric and Bladder Calculi in Ultrasound Images,2012_8_5_jcssp.2012.716.720.pdf,https://thescipub.com/pdf/jcssp.2012.716.720.pdf
Efficient Broadcasting in Mobile Ad Hoc Networks Using Context Aware Adaptive Routing Protocol during Network Partitions,2012_8_5_jcssp.2012.721.730.pdf,https://thescipub.com/pdf/jcssp.2012.721.730.pdf
A Survey on Joint Compression and Encryption Techniques for Video Data,2012_8_5_jcssp.2012.731.736.pdf,https://thescipub.com/pdf/jcssp.2012.731.736.pdf
Implementation of a Novel Control Strategy Using Fuzzy Logic Controller to Shunt Active Filter for Line Harmonic Reduction,2012_8_5_jcssp.2012.737.746.pdf,https://thescipub.com/pdf/jcssp.2012.737.746.pdf
Medical Image Compression with Lossless Region of Interest Using Adaptive Active Contour,2012_8_5_jcssp.2012.747.751.pdf,https://thescipub.com/pdf/jcssp.2012.747.751.pdf
The Impact of Radio Propagation Models on Ad Hoc Networks Performances,2012_8_5_jcssp.2012.752.760.pdf,https://thescipub.com/pdf/jcssp.2012.752.760.pdf
Realization of Fault Tolerant Routing Protocol for Zigbee,2012_8_5_jcssp.2012.761.766.pdf,https://thescipub.com/pdf/jcssp.2012.761.766.pdf
A New Hybrid Approach for Heterogeneous Radio Access Technology Selection,2012_8_5_jcssp.2012.767.774.pdf,https://thescipub.com/pdf/jcssp.2012.767.774.pdf
An Efficient Method for Contrast Enhancement in Still Images using Histogram Modification Framework,2012_8_5_jcssp.2012.775.779.pdf,https://thescipub.com/pdf/jcssp.2012.775.779.pdf
A Dynamic Resource Allocation Method for Parallel DataProcessing in Cloud Computing,2012_8_5_jcssp.2012.780.788.pdf,https://thescipub.com/pdf/jcssp.2012.780.788.pdf
Performance Analysis of Multi Spectral Band Image Compression using Discrete Wavelet Transform,2012_8_5_jcssp.2012.789.795.pdf,https://thescipub.com/pdf/jcssp.2012.789.795.pdf
Intelligent Semantic Universal Search in Mobile Platform,2012_8_5_jcssp.2012.796.803.pdf,https://thescipub.com/pdf/jcssp.2012.796.803.pdf
Normalized Web Distance Based Web Query Classification,2012_8_5_jcssp.2012.804.808.pdf,https://thescipub.com/pdf/jcssp.2012.804.808.pdf
Generalization of Boolean Functions Properties to Functions Defined over GF(p),2012_8_6_jcssp.2012.809.814.pdf,https://thescipub.com/pdf/jcssp.2012.809.814.pdf
Low Transition-Generalized Linear Feedback Shift Register Based Test Pattern Generator Architecture for Built-in-Self-Test,2012_8_6_jcssp.2012.815.821.pdf,https://thescipub.com/pdf/jcssp.2012.815.821.pdf
Automatic Specification Evaluator for Effective Migration,2012_8_6_jcssp.2012.822.827.pdf,https://thescipub.com/pdf/jcssp.2012.822.827.pdf
Effective Authentication Technique for Distributed Denial of Service Attacks in Wireless Local Area Networks,2012_8_6_jcssp.2012.828.834.pdf,https://thescipub.com/pdf/jcssp.2012.828.834.pdf
Efficient Web Usage Miner Using Decisive Induction Rules,2012_8_6_jcssp.2012.835.840.pdf,https://thescipub.com/pdf/jcssp.2012.835.840.pdf
A New Algorithm for Fractal Coding Using Self Organizing Map,2012_8_6_jcssp.2012.841.845.pdf,https://thescipub.com/pdf/jcssp.2012.841.845.pdf
Ant Colony Optimization for Capacitated Vehicle Routing Problem,2012_8_6_jcssp.2012.846.852.pdf,https://thescipub.com/pdf/jcssp.2012.846.852.pdf
Video Retrieval using Histogram and Sift Combined with Graph-based Image Segmentation,2012_8_6_jcssp.2012.853.858.pdf,https://thescipub.com/pdf/jcssp.2012.853.858.pdf
Adaptable Service Component Interface Framework in Pervasive Computing,2012_8_6_jcssp.2012.859.863.pdf,https://thescipub.com/pdf/jcssp.2012.859.863.pdf
New Optical Splitter Design for Application in Fibre-to-the Home Passive Optical Network using Virtual Lab Platform,2012_8_6_jcssp.2012.864.871.pdf,https://thescipub.com/pdf/jcssp.2012.864.871.pdf
Privacy Preserved Collaborative Secure Multiparty Data Mining,2012_8_6_jcssp.2012.872.878.pdf,https://thescipub.com/pdf/jcssp.2012.872.878.pdf
